{
  "$schema": "https://json-schema.org/draft/2020-12/schema",
  "$id": "urn:jellyfin-canopy:platform:v1:extension-manifest",
  "title": "Jellyfin Canopy installed-provider extension manifest v1",
  "description": "The closed, bounded declaration carried by jellyfin-canopy-extension.json. A valid manifest requests capabilities and may describe provider operations; it is not installation proof, approval, a grant, registry identity, callability, or authority.",
  "type": "object",
  "additionalProperties": false,
  "x-canopy-maximum-document-bytes": 262144,
  "x-canopy-maximum-json-depth": 16,
  "x-canopy-fingerprint-algorithm": "sha-256",
  "x-canopy-fingerprint-domain": "jellyfin-canopy-extension-manifest-v1",
  "x-canopy-unknown-properties": "reject",
  "x-canopy-provider-entrypoint-type": "JellyfinCanopy.ExtensionProviderEntrypoint",
  "x-canopy-provider-invocation-method": "InvokeAsync",
  "x-canopy-provider-invocation-signature": "Task<string> InvokeAsync(string operationId, string requestJson, CancellationToken cancellationToken)",
  "x-canopy-provider-schema-resource-template": "JellyfinCanopy.ProviderSchemas.{sha256}.json",
  "x-canopy-identity-only-non-callable": true,
  "required": [
    "schemaVersion",
    "id",
    "pluginId",
    "version",
    "kind",
    "displayName",
    "platform",
    "host",
    "requestedCapabilities"
  ],
  "properties": {
    "schemaVersion": {
      "type": "integer",
      "const": 1
    },
    "id": {
      "type": "string",
      "minLength": 3,
      "maxLength": 128,
      "x-canopy-maximum-segment-length": 64,
      "pattern": "^[a-z][a-z0-9]*(?:-[a-z0-9]+)*(?:\\.[a-z][a-z0-9]*(?:-[a-z0-9]+)*)+$",
      "description": "Stable lower-case ASCII namespace with at least two dot-separated segments. Every segment begins with a letter and may contain letters, digits, and internal hyphens."
    },
    "pluginId": {
      "type": "string",
      "minLength": 36,
      "maxLength": 36,
      "pattern": "^[0-9a-f]{8}-[0-9a-f]{4}-[0-9a-f]{4}-[0-9a-f]{4}-[0-9a-f]{12}$",
      "not": {
        "const": "00000000-0000-0000-0000-000000000000"
      },
      "description": "Canonical lower-case Guid D text. Later discovery must bind it to Jellyfin-reported plugin identity."
    },
    "version": {
      "type": "string",
      "minLength": 3,
      "maxLength": 64,
      "pattern": "^(?:0|[1-9][0-9]{0,8}|1[0-9]{9}|20[0-9]{8}|21[0-3][0-9]{7}|214[0-6][0-9]{6}|2147[0-3][0-9]{5}|21474[0-7][0-9]{4}|214748[0-2][0-9]{3}|2147483[0-5][0-9]{2}|21474836[0-3][0-9]|214748364[0-7])(?:\\.(?:0|[1-9][0-9]{0,8}|1[0-9]{9}|20[0-9]{8}|21[0-3][0-9]{7}|214[0-6][0-9]{6}|2147[0-3][0-9]{5}|21474[0-7][0-9]{4}|214748[0-2][0-9]{3}|2147483[0-5][0-9]{2}|21474836[0-3][0-9]|214748364[0-7])){1,3}$",
      "description": "Canonical two-to-four-component System.Version text with every component bounded to Int32.MaxValue. Runtime validation also requires a successful invariant parse and exact round trip."
    },
    "kind": {
      "type": "string",
      "const": "installed-provider"
    },
    "displayName": {
      "type": "string",
      "minLength": 1,
      "maxLength": 96,
      "x-canopy-maximum-utf8-bytes": 96,
      "x-canopy-text-policy": "trimmed-no-control-or-format"
    },
    "description": {
      "type": "string",
      "minLength": 0,
      "maxLength": 512,
      "x-canopy-maximum-utf8-bytes": 512,
      "x-canopy-text-policy": "trimmed-no-control-or-format"
    },
    "platform": {
      "type": "object",
      "additionalProperties": false,
      "required": [
        "min",
        "max"
      ],
      "properties": {
        "min": {
          "type": "integer",
          "minimum": 1,
          "maximum": 65535
        },
        "max": {
          "type": "integer",
          "minimum": 1,
          "maximum": 65535
        }
      },
      "x-canopy-range-order": "min<=max",
      "description": "Inclusive Platform major range. Runtime validation rejects min greater than max."
    },
    "host": {
      "type": "object",
      "additionalProperties": false,
      "required": [
        "minMajor",
        "maxMajor"
      ],
      "properties": {
        "minMajor": {
          "type": "integer",
          "minimum": 1,
          "maximum": 65535
        },
        "maxMajor": {
          "type": "integer",
          "minimum": 1,
          "maximum": 65535
        }
      },
      "x-canopy-range-order": "minMajor<=maxMajor",
      "description": "Inclusive Jellyfin host-major range. Runtime validation rejects minMajor greater than maxMajor."
    },
    "requestedCapabilities": {
      "type": "array",
      "minItems": 0,
      "maxItems": 9,
      "uniqueItems": true,
      "items": {
        "type": "string",
        "enum": [
          "jellyfin.canopy.items.lookup",
          "jellyfin.canopy.user-data.read",
          "jellyfin.canopy.storage.read",
          "jellyfin.canopy.ui.contribute",
          "jellyfin.canopy.integrations.invoke"
        ]
      },
      "description": "Exact case-sensitive requested capabilities eligible for the installed-provider actor ceiling. Input order is semantically irrelevant and runtime canonicalizes to frozen vocabulary order."
    },
    "providerOperations": {
      "type": "array",
      "minItems": 0,
      "maxItems": 16,
      "x-canopy-unique-by": "id",
      "x-canopy-semantic-order": "id-ordinal",
      "description": "Optional non-authoritative provider operation declarations. Absent or empty means identity-only and non-callable. The code-owned entrypoint convention above is fixed; no manifest field may select code, a path, a CLR type, or a method.",
      "items": {
        "type": "object",
        "additionalProperties": false,
        "required": [
          "id",
          "protocol",
          "requiredCapabilities",
      "requestSchemaId",
      "requestSchemaSha256",
      "responseSchemaId",
      "responseSchemaSha256"
        ],
        "properties": {
          "id": {
            "type": "string",
            "minLength": 5,
            "maxLength": 128,
            "x-canopy-maximum-utf8-bytes": 128,
            "pattern": "^[a-z][a-z0-9]*(?:-[a-z0-9]+)*\\.[a-z][a-z0-9]*(?:-[a-z0-9]+)*(?:\\.[a-z][a-z0-9]*(?:-[a-z0-9]+)*)+$",
            "description": "Exact case-sensitive lower-case ASCII operation id with at least three dot-separated namespace segments."
          },
          "protocol": {
            "type": "object",
            "additionalProperties": false,
            "required": [
              "min",
              "max"
            ],
            "properties": {
              "min": {
                "type": "integer",
                "minimum": 1,
                "maximum": 65535
              },
              "max": {
                "type": "integer",
                "minimum": 1,
                "maximum": 65535
              }
            },
            "x-canopy-range-order": "min<=max",
            "x-canopy-contained-by": "$.platform",
            "description": "Inclusive protocol range, wholly contained by the manifest platform range."
          },
          "requiredCapabilities": {
            "type": "array",
            "minItems": 0,
            "maxItems": 5,
            "uniqueItems": true,
            "items": {
              "type": "string",
              "enum": [
                "jellyfin.canopy.items.lookup",
                "jellyfin.canopy.user-data.read",
                "jellyfin.canopy.storage.read",
                "jellyfin.canopy.ui.contribute",
                "jellyfin.canopy.integrations.invoke"
              ]
            },
            "x-canopy-subset-of": "$.requestedCapabilities",
            "description": "Provider-eligible capabilities required for this operation, each also requested at the manifest root."
          },
      "requestSchemaId": {
            "type": "string",
            "minLength": 1,
            "maxLength": 308,
            "x-canopy-maximum-utf8-bytes": 308,
            "pattern": "^urn:jellyfin-canopy:provider-schema:[a-z][a-z0-9]*(?:-[a-z0-9]+)*(?:\\.[a-z][a-z0-9]*(?:-[a-z0-9]+)*)+:[a-z][a-z0-9]*(?:-[a-z0-9]+)*\\.[a-z][a-z0-9]*(?:-[a-z0-9]+)*(?:\\.[a-z][a-z0-9]*(?:-[a-z0-9]+)*)+:request:(?:[1-9]|[1-9][0-9]{1,3}|[1-5][0-9]{4}|6[0-4][0-9]{3}|65[0-4][0-9]{2}|655[0-2][0-9]|6553[0-5])$",
            "x-canopy-owned-reference-template": "urn:jellyfin-canopy:provider-schema:{manifest.id}:{operation.id}:request:{schemaMajor}",
            "x-canopy-maximum-schema-major": 65535,
        "description": "A symbolic, non-resolvable request payload schema identifier owned by this exact manifest and operation. It is not a URL or path."
      },
      "requestSchemaSha256": {
        "type": "string",
        "minLength": 64,
        "maxLength": 64,
        "pattern": "^[0-9a-f]{64}$",
        "x-canopy-embedded-resource-template": "JellyfinCanopy.ProviderSchemas.{sha256}.json",
        "description": "Canonical lower-case SHA-256 content address for the request payload schema embedded in the provider assembly under the fixed code-owned resource name. It is not a path or CLR selector."
      },
      "responseSchemaId": {
            "type": "string",
            "minLength": 1,
            "maxLength": 308,
            "x-canopy-maximum-utf8-bytes": 308,
            "pattern": "^urn:jellyfin-canopy:provider-schema:[a-z][a-z0-9]*(?:-[a-z0-9]+)*(?:\\.[a-z][a-z0-9]*(?:-[a-z0-9]+)*)+:[a-z][a-z0-9]*(?:-[a-z0-9]+)*\\.[a-z][a-z0-9]*(?:-[a-z0-9]+)*(?:\\.[a-z][a-z0-9]*(?:-[a-z0-9]+)*)+:response:(?:[1-9]|[1-9][0-9]{1,3}|[1-5][0-9]{4}|6[0-4][0-9]{3}|65[0-4][0-9]{2}|655[0-2][0-9]|6553[0-5])$",
            "x-canopy-owned-reference-template": "urn:jellyfin-canopy:provider-schema:{manifest.id}:{operation.id}:response:{schemaMajor}",
            "x-canopy-maximum-schema-major": 65535,
        "description": "A symbolic, non-resolvable response payload schema identifier owned by this exact manifest and operation. It is not a URL or path."
      },
      "responseSchemaSha256": {
        "type": "string",
        "minLength": 64,
        "maxLength": 64,
        "pattern": "^[0-9a-f]{64}$",
        "x-canopy-embedded-resource-template": "JellyfinCanopy.ProviderSchemas.{sha256}.json",
        "description": "Canonical lower-case SHA-256 content address for the response payload schema embedded in the provider assembly under the fixed code-owned resource name. It is not a path or CLR selector."
      }
        }
      }
    }
  }
}
