{
  "schemaVersion": 1,
  "id": "org.example.provider",
  "pluginId": "12345678-9abc-4def-8123-456789abcdef",
  "version": "1.2.3.4",
  "kind": "installed-provider",
  "displayName": "Example Provider",
  "description": "A bounded installed-provider fixture.",
  "platform": {
    "min": 1,
    "max": 1
  },
  "host": {
    "minMajor": 12,
    "maxMajor": 12
  },
  "requestedCapabilities": [
    "jellyfin.canopy.items.lookup",
    "jellyfin.canopy.user-data.read",
    "jellyfin.canopy.storage.read",
    "jellyfin.canopy.ui.contribute",
    "jellyfin.canopy.integrations.invoke"
  ]
}
